Cites,Authors,Title,Year,Source,Publisher,ArticleURL,CitesURL,GSRank,QueryDate,Type,DOI,ISSN,CitationURL,Volume,Issue,StartPage,EndPage,ECC,CitesPerYear,CitesPerAuthor,AuthorCount,Age,Abstract,FullTextURL,RelatedURL
0,"Ferran Solanes Vilanova, Annemie Van Caelenberg, Joana Pontes, Tom Hellebuyck",Vertebral Osteomyelitis in a Black Spiny-Tailed Iguana (Ctenosaura similis) and a Red Tegu (Salvator rufescens),2023,Journal of Herpetological Medicine and Surgery,Association of Reptilian and Amphibian Veterinarians (ARAV),https://doi.org/10.5818/jhms-d-22-00031,,917,8/11/2025 21:21,journal-article,10.5818/jhms-d-22-00031,2374-9504,,33,2,101,108,0,0,0,4,2,"Abstract: This report describes the clinical, gross pathologic, and radiologic features of vertebral osteomyelitis in a black spiny-tailed iguana (Ctenosaura similis) and a red tegu (Salvator rufescens). Both lizards were presented with hind limb ataxia and proprioception deficits. Based on radiographic imaging and computed tomography, a presumptive diagnosis of vertebral osteomyelitis was made. Microbiological examination of vertebral body biopsies revealed Morganella morganii and Enterococcus faecalis infection in the black spiny-tailed iguana and Enterobacter cloacae infection in the red tegu. Failure of antimicrobial treatment in both lizards was considered to be at least partly attributable to the tardy onset of clinical signs resulting in a late diagnosis and pronounced chronicity of the vertebral lesions. Although vertebral osteomyelitis has been repeatedly reported in snakes, reports in saurian species are scarce and anecdotal. Based on the findings in these cases, however, vertebral osteomyelitis should be considered as an important differential diagnosis for hind limb ataxia in lizards.",https://meridian.allenpress.com/jhms/article-pdf/doi/10.5818/JHMS-D-22-00031/3192097/jhms-d-22-00031.pdf,
10,"Lianne M. Koczur, Gina M. Kent, Bart M. Ballard, Kenneth D. Meyer, M. Clay Green",Space Use and Movements of Adult Reddish Egrets (<i>Egretta rufescens</i>) During Winter,2018,Waterbirds,Waterbird Society,https://doi.org/10.1675/063.041.0102,,918,8/11/2025 21:21,journal-article,10.1675/063.041.0102,1524-4695,,41,1,1,15,10,1.43,2,5,7,,http://www.bioone.org/doi/full-xml/10.1675/063.041.0102,
15,S Huchette,"Maternal variability in the blacklip abalone, Haliotis rubra leach (Mollusca: Gastropoda): effect of egg size on fertilisation success",2004,Aquaculture,Elsevier BV,https://doi.org/10.1016/j.aquaculture.2003.08.027,,919,8/11/2025 21:21,journal-article,10.1016/j.aquaculture.2003.08.027,0044-8486,,231,1,181,195,15,0.71,15,1,21,,https://api.elsevier.com/content/article/PII:S0044-8486(03)00577-5,
17,"Nobuo Ueda, Sandie M. Degnan",Nitric oxide is not a negative regulator of metamorphic induction in the abalone Haliotis asinina,2014,Frontiers in Marine Science,Frontiers Media SA,https://doi.org/10.3389/fmars.2014.00021,,920,8/11/2025 21:21,journal-article,10.3389/fmars.2014.00021,2296-7745,,1,,,,17,1.55,9,2,11,,,
10,"Donato A. Grasso, Alessandra Mori, Francesco Le Moli, Johan Billen","Morpho-functional comparison of the Dufour gland in the female castes of the Amazon ant Polyergus rufescens (Hymenoptera, Formicidae)",2005,Zoomorphology,Springer Science and Business Media LLC,https://doi.org/10.1007/s00435-005-0003-8,,921,8/11/2025 21:21,journal-article,10.1007/s00435-005-0003-8,0720-213X,,124,3,149,153,10,0.5,3,4,20,,https://link.springer.com/content/pdf/10.1007/s00435-005-0003-8.pdf,
24,"C.P. Suja, S. Dharmaraj",In vitro culture of mantle tissue of the abalone Haliotis varia Linnaeus,2005,Tissue and Cell,Elsevier BV,https://doi.org/10.1016/j.tice.2004.08.002,,922,8/11/2025 21:21,journal-article,10.1016/j.tice.2004.08.002,0040-8166,,37,1,1,10,24,1.2,12,2,20,,https://api.elsevier.com/content/article/PII:S004081660400062X,
0,"Hansol Doh, Min Hyeock Lee",Total Iodine Quantification and In Vitro Bioavailability Study in Abalone (Haliotis discus hannai) Using Inductively Coupled Plasma Mass Spectrometry,2024,Foods,MDPI AG,https://doi.org/10.3390/foods13091400,,923,8/11/2025 21:21,journal-article,10.3390/foods13091400,2304-8158,,13,9,1400,1400,0,0,0,2,1,"The aim of this study is to determine the total iodine content in Korean abalone (Haliotis discus hannai) and to investigate the bioavailability of iodine using an in vitro method. This research paper focuses on total iodine quantification in abalone (Haliotis discus hannai) and its components (viscera and muscle) using inductively coupled plasma mass spectrometry (ICP-MS). Additionally, an in vitro bioavailability study explored iodine absorption potential. Abalone pretreatment involved both the European standard method (ES) and microwave-assisted extraction method (MAE). The limits of detection (LOD) were 0.11 ng/g for both ES and MAE, with a limit of quantification (LOQ) of 5.4 ng/g for MAE. Accuracy, assessed using a reference material (fish muscle, ERM—BB422), showed values of 1.5 ± 0.010 mg/kg for ES and 1.6 ± 0.066 mg/kg for MAE, within an acceptable range of 1.4 ± 0.42 mg/kg. Precision, evaluated using the Horwitz ratio (HorRat) with a reference material, was determined to be 0.45 for ES and 0.27 for MAE. Therefore, total iodine contents were estimated as 74 ± 2.2 µg/g for abalone viscera and 17 ± 0.77 µg/g for abalone muscle with ES, and 76 ± 1.0 µg/g for abalone viscera and 17 ± 0.51 µg/g for abalone muscle with MAE. Recovery tests demonstrated an acceptable range of 90–110%. In the in vitro bioavailability assessment, digestion efficiency yielded ranges of 42–50.2% for viscera and 67–115% for muscle. Absorption efficiency variations were determined as 37–43% for viscera and 48–75% for muscle.",https://www.mdpi.com/2304-8158/13/9/1400/pdf,
13,"H.J. Morales‐Moreno, C. Carranza‐Rodriguez, L. Borrego",Cutaneous loxoscelism due to <i>Loxosceles rufescens</i>,2015,Journal of the European Academy of Dermatology and Venereology,Wiley,https://doi.org/10.1111/jdv.13274,,924,8/11/2025 21:21,journal-article,10.1111/jdv.13274,0926-9959,,30,8,1431,1432,13,1.3,4,3,10,,https://api.wiley.com/onlinelibrary/tdm/v1/articles/10.1111%2Fjdv.13274,
11,"Rolando S.J. Gapasin, Bernice B. Polohan","Response of the Tropical Abalone, Haliotis asinina, Larvae on Combinations of Attachment Cues",2005,Hydrobiologia,Springer Science and Business Media LLC,https://doi.org/10.1007/s10750-005-0754-8,,925,8/11/2025 21:21,journal-article,10.1007/s10750-005-0754-8,0018-8158,,548,1,301,306,11,0.55,6,2,20,,http://link.springer.com/content/pdf/10.1007/s10750-005-0754-8.pdf,
19,"Yi Xin, Jianfeng Ren, Xiao Liu",Mitogenome of the small abalone Haliotis diversicolor Reeve and phylogenetic analysis within Gastropoda,2011,Marine Genomics,Elsevier BV,https://doi.org/10.1016/j.margen.2011.06.005,,926,8/11/2025 21:21,journal-article,10.1016/j.margen.2011.06.005,1874-7787,,4,4,253,262,19,1.36,6,3,14,,https://api.elsevier.com/content/article/PII:S1874778711000481,
18,"Thao V. Nguyen, Andrea C. Alfaro, Craig Mundy, Jillian Petersen, Norman L.C. Ragg",Omics research on abalone (Haliotis spp.): Current state and perspectives,2022,Aquaculture,Elsevier BV,https://doi.org/10.1016/j.aquaculture.2021.737438,,927,8/11/2025 21:21,journal-article,10.1016/j.aquaculture.2021.737438,0044-8486,,547,,737438,737438,18,6,4,5,3,,https://api.elsevier.com/content/article/PII:S0044848621011017,
5,Dwi E.D. Setyono,"REPRODUCTIVE ASPECTS OF THE TROPICAL ABALONE, HALIOTIS ASININA, FROM SOUTHERN LOMBOK WATERS, INDONESIA",2018,Marine Research in Indonesia,Indonesian Institute of Sciences,https://doi.org/10.14203/mri.v30i0.420,,928,8/11/2025 21:21,journal-article,10.14203/mri.v30i0.420,2443-2008,,30,,1,14,5,0.71,5,1,7,"The main objective of this study was to determine reproductive strategy including major spawning season of tropical abalone (Haliotis asinina) from southern Lombok waters, Indonesia. Gonad bulk index, maturity stages and oocyte size frequency distribution were applied to document gonadal development and major spawning season. The results of this study show that H. asinina in southern Lombok waters displayed year-round spawning with a high proportion occurring in August - November, when gonad index dropped to a lower level and high proportion of partly spawned and/or spent ovaries occurred in the population. Gonad development and spawning in males and females occurred synchronously. The correlation between gonadal development and environmental factors are described and discussed.",https://mri.lipi.go.id/index.php/MRI/article/download/420/240,
4,"Yukino Mizutani, Reiji Tanaka","Genome Sequence of <i>Arcobacter</i> sp. Strain LA11, Isolated from the Abalone <i>Haliotis discus</i>",2017,Genome Announcements,American Society for Microbiology,https://doi.org/10.1128/genomea.00032-17,,929,8/11/2025 21:21,journal-article,10.1128/genomea.00032-17,2169-8287,,5,11,,,4,0.5,2,2,8,ABSTRACT:,https://journals.asm.org/doi/pdf/10.1128/genomeA.00032-17,
14,"Charles Bursey, Stephen Goldberg, Fred Kraus","A new species of Moaciria (Nematoda, Heterakidae) and other helminths in the red Mawatta frog, Hylophorbus cf. rufescens (Anura, Microhylidae) from Papua New Guinea",2007,Acta Parasitologica,Walter de Gruyter GmbH,https://doi.org/10.2478/s11686-007-0027-y,,930,8/11/2025 21:21,journal-article,10.2478/s11686-007-0027-y,1896-1851,,52,3,,,14,0.78,5,3,18,"Abstract: Moaciria moraveci sp. nov. (Nematoda, Heterakidae) from the large intestine of Hylophorbus cf. rufescens from Papua New Guinea is described. Moaciria moraveci sp. nov. represents the 9th species assigned to the genus and the 5th from the Australo-Papuan region. It is distinguished from congeners by the distribution pattern of the caudal papillae of the male, spicule length and vulvar position.",http://link.springer.com/content/pdf/10.2478/s11686-007-0027-y.pdf,
0,"Santiago Duque-Arias, José L. Caraballo Ávila, Daisy A. Gómez-Ruiz",Descripción anatomopatológica de un caso de traumatología en puercoespín (Coendou rufescens),2023,Revista de Investigaciones Veterinarias del Perú,"Universidad Nacional Mayor de San Marcos, Vicerectorado de Investigacion",https://doi.org/10.15381/rivep.v34i2.23082,,931,8/11/2025 21:21,journal-article,10.15381/rivep.v34i2.23082,1682-3419,,34,2,,,0,0,0,3,2,"El puercoespín Coendou rufescens es un roedor de hábitos arborícolas y locomoción trepadora, pero pueden desplazarse con facilidad en el suelo de manera ocasional, lo cual los hace vulnerables a las colisiones por atropellamiento en áreas naturales inmersas en zonas urbanas con alto flujo vehicular. En este trabajo se presenta el caso de atropellamiento de un puercoespín macho adulto en el norte de la Cordillera Central de Colombia, mediante la implementación de una evaluación radiográfica y post mortem. El estudio radiológico evidenció múltiples fracturas a nivel de cráneo, extremidades anteriores, parrilla costal derecha y los cuerpos vertebrales. La necropsia mostró múltiples lesiones en el sistema tegumentario, músculo esquelético y sistema nervioso, incluyendo la presencia de politraumatismo en cabeza y cuello, con pérdida de la parte superior del cráneo y la ruptura del corazón a nivel de ambos atrios. Los hallazgos más importantes incluyeron el estallido cardíaco y la fragmentación del cráneo, siendo difícil establecer la causa específica de muerte.",https://revistasinvestigacion.unmsm.edu.pe/index.php/veterinaria/article/download/23082/19503,
0,"Rahmat Arif Adimulya, Onu La Ola, Azhar Bafadal",ANALISIS PENDAPATAN DAN PROSPEK AGRIBISNIS ABALON (HALIOTIS ASININA) DI KABUPATEN KONAWE DAN KOTA KENDARI,2017,Jurnal Sosio Agribisnis,Universitas Halu Oleo,https://doi.org/10.33772/jsa.v1i1.1835,,932,8/11/2025 21:21,journal-article,10.33772/jsa.v1i1.1835,2502-3292,,1,1,,,0,0,0,3,8,"Abalone (Haliotis asinina) is one of the economically valuable commodities of fishery. Abalon products have a high prices and market demand especially to export. This condition, abalone businesses should get a high income for them. The research was to analyze the abalone business doer in each level and developing prospect of abalone agribusiness in Southeast Sulawesi based on the relationship between agribusiness sub-system and the income gained. Respondents and population of research was the whole abalone business comprised of fishermen, cultivator, collector venders, and inter venders. Descriptive analysis is used to find out the relationship of abalone agribusiness sub-system, while income analysis is used to find out the income of abalone agribusiness. To see the prospect of abalone agribusiness the analysis of descriptive and income is used. Result of the research shown that the relationship of abalone agribusiness has not well integrated. The income gained by fishermen per season is Rp.309.211,- , and the collector vender is Rp.9.830.734,-, while the income of inter  vender of province is Rp.12.282.976,-. From the result of the analysis can be concluded that abalone agribusiness has an average prospect to be developed in Konawe Regency.Keywords: abalone, agribusiness, income analysis, prospect of abalone",http://ojs.uho.ac.id/index.php/JSA/article/viewFile/1835/1292,
9,"Fay Helidoniotis, Malcolm Haddon",Growth model selection for juvenile blacklip abalone (Haliotis rubra): assessing statistical and biological validity,2012,Marine and Freshwater Research,CSIRO Publishing,https://doi.org/10.1071/mf11103,,933,8/11/2025 21:21,journal-article,10.1071/mf11103,1323-1650,,63,1,23,23,9,0.69,5,2,13,"Accurate estimates of marine organism growth are important for modelling the dynamics of populations and rely on the selection of an appropriate growth model. However, there is no assurance that the statistically optimum model will also be biologically plausible. Three growth models (von Bertalanffy, Gompertz and a linear model) were fitted to a dataset consisting of two cohorts of juvenile size classes of blacklip abalone (Haliotis rubra). Results show that the non-seasonal Gompertz was statistically better than the non-seasonal von Bertalanffy and linear models. There was a persistent seasonal signal through the juvenile size range, with slow growth in winter and fast growth during summer. When a seasonal term was formally incorporated, the model fits were greatly improved, particularly for the linear and von Bertalanffy models. The seasonal-Gompertz predicted growth rates that were biologically implausible for juveniles of 2 mm shell length; 107 μm day–1 for one cohort and 24 μm day–1 for the other. These rates are inconsistent with published growth rates observed under both controlled and wild conditions. In contrast, the seasonal-linear model predicted growth rates of 60 μm day–1 for animals of 2 mm shell length, consistent with published findings. The selection of a growth model based solely on statistical criteria may not take into account the complex processes that influence growth of juveniles.",http://www.publish.csiro.au/MF/pdf/MF11103,
37,"Mathilde van der Merwe, Paolo Franchini, Rouvay Roodt-Wilding",Differential Growth-Related Gene Expression in Abalone (Haliotis midae),2011,Marine Biotechnology,Springer Science and Business Media LLC,https://doi.org/10.1007/s10126-011-9376-5,,934,8/11/2025 21:21,journal-article,10.1007/s10126-011-9376-5,1436-2228,,13,6,1125,1139,37,2.64,12,3,14,,http://link.springer.com/content/pdf/10.1007/s10126-011-9376-5.pdf,
1,"Stefano Veraldi, Rossana Schianchi, Gianluca Nazzaro",Necrotic ulcers caused by Loxosceles rufescens bites: a report of seven patients and scanning electron microscopy of the spider,2024,European Journal of Dermatology,JLE,https://doi.org/10.1684/ejd.2024.4700,,935,8/11/2025 21:21,journal-article,10.1684/ejd.2024.4700,1167-1122,,34,3,267,270,1,1,0,3,1,,https://www.jle.com/10.1684/ejd.2024.4700,
32,"JIANG-YUN GAO, PAN-YU REN, ZI-HUI YANG, QING-JUN LI",The Pollination Ecology of Paraboea rufescens (Gesneriaceae): a Buzz-pollinated Tropical Herb with Mirror-image Flowers,2005,Annals of Botany,Oxford University Press (OUP),https://doi.org/10.1093/aob/mcj044,,936,8/11/2025 21:21,journal-article,10.1093/aob/mcj044,1095-8290,,97,3,371,376,32,1.6,8,4,20,,http://academic.oup.com/aob/article-pdf/97/3/371/13160410/mcj044.pdf,
0,"Yulin Ren, Francisco Jimenez, Ricardo Garcia, Milciades Mejia, Heebyung Chai, Norman R. Farnsworth, Djaja D. Soejarto, A. Douglas Kinghorn",ChemInform Abstract: A Cytotoxic Dimeric Furanoheliangolide from Piptocoma rufescens,2014,ChemInform,Wiley,https://doi.org/10.1002/chin.201404200,,937,8/11/2025 21:21,journal-article,10.1002/chin.201404200,0931-7597,,45,4,,,0,0,0,8,11,,https://api.wiley.com/onlinelibrary/tdm/v1/articles/10.1002%2Fchin.201404200,
4,"E. Day, G. M. Branch",Effects of Sea Urchins (Parechinus angulosus) on Recruits and Juveniles of Abalone (Haliotis midae),2002,Ecological Monographs,Wiley,https://doi.org/10.2307/3100089,,938,8/11/2025 21:21,journal-article,10.2307/3100089,0012-9615,,72,1,133,133,4,0.17,2,2,23,,http://api.wiley.com/onlinelibrary/tdm/v1/articles/10.2307%2F3100089,
0,"Ermayanti Ishak, Muhammad Taswin Munier, Muhammad Trial",Size distribution of Haliotis asinina and abundance of periphyton in tapulaga waters,2025,Depik,"Institute of Postgraduate Studies, Syiah Kuala University",https://doi.org/10.13170/depik.14.1.42737,,939,8/11/2025 21:21,journal-article,10.13170/depik.14.1.42737,2502-6194,,14,1,12,17,0,0,0,3,1,"The Tapulaga waters, located in Soropia, Southeast Sulawesi, are among the coastal waters with significant potential for the seven-eyed abalone (Haliotis asinina). This species is a herbivorous gastropod that primarily consumes natural food sources such as periphyton and macroalgae. This study aims to determine the size distribution of H. asinina and analyze the presence of periphyton on seagrass leaves and macroalgal thalli. Sampling was conducted over six months in the Tapulaga waters of Soropia, Konawe Regency, Southeast Sulawesi, using a simple random sampling technique. The collected data were analyzed using descriptive statistical methods. The results indicate that the highest percentage of size distribution was observed in the range of 37.5–44.5 mm, comprising 34% of the total population. The population was categorized into two size groups: juveniles (≤ 49 mm) and adults (≥ 50 mm). Juveniles accounted for 75% of the total H. asinina population, while adults comprised 25%. A total of 11 periphyton species from three taxonomic classes Bacillariophyceae, Cyanophyceae, and Trebouxiophyceae—were identified on the seagrass species Enhalus acoroides and the macroalgae Gracilaria salicornia, Padina sp., Halimeda sp., Galaxaura sp., and Gelidium sp. The identified periphyton species included Aulacoseira sp., Nitzschia sp., Synedra sp., Diatoma sp., Fragilaria sp., Navicula sp., Pinnularia sp., Melosira sp., Lyngbya sp., Planctonema sp., and Cocconeis sp. Six of these periphyton species were present on both seagrass and macroalgal thalli. Synedra sp. was the most dominant species, exhibiting the highest abundance at 88,876 individuals/cm². The presence of periphyton as a natural food source attached to seagrass leaves and macroalgal thalli plays a crucial role in supporting the juvenile H. asinina population.Keywords:H. asininaMacroalgaePeriphytonTapulaga",https://jurnal.usk.ac.id/depik/article/viewFile/42737/pdf,
58,"S. Thongrod, M. Tamtin, C. Chairat, M. Boonyaratpalin","Lipid to carbohydrate ratio in donkey's ear abalone (Haliotis asinina, Linne) diets",2003,Aquaculture,Elsevier BV,https://doi.org/10.1016/s0044-8486(03)00287-4,,940,8/11/2025 21:21,journal-article,10.1016/s0044-8486(03)00287-4,0044-8486,,225,1,165,174,58,2.64,15,4,22,,https://api.elsevier.com/content/article/PII:S0044848603002874,
11,"KANGSEN MAI, WEI ZHU, GETIAN WU","PYRIDOXINE REQUIREMENT OF JUVENILE ABALONE, HALIOTIS DISCUS HANNAI INO",2007,Journal of Shellfish Research,National Shellfisheries Association,https://doi.org/10.2983/0730-8000(2007)26[815:projah]2.0.co;2,,941,8/11/2025 21:21,journal-article,10.2983/0730-8000(2007)26[815:projah]2.0.co;2,0730-8000,,26,3,815,820,11,0.61,4,3,18,,,
0,,"Haliotis discus ssp. hannai: Peters, H., Takami, H., Kiyomoto, S. &amp; Kawamura, T.",2022,IUCN Red List of Threatened Species,IUCN,https://doi.org/10.2305/iucn.uk.2022-2.rlts.t215430111a215430123.en,,942,8/11/2025 21:21,dataset,10.2305/iucn.uk.2022-2.rlts.t215430111a215430123.en,,,,,,,0,0,0,0,3,,,
35,"Yibing Liu, Tong Xu, Nicholas Robinson, Jianguang Qin, Xiaoxu Li",Cryopreservation of sperm in farmed Australian greenlip abalone Haliotis laevigata,2014,Cryobiology,Elsevier BV,https://doi.org/10.1016/j.cryobiol.2014.01.002,,943,8/11/2025 21:21,journal-article,10.1016/j.cryobiol.2014.01.002,0011-2240,,68,2,185,193,35,3.18,7,5,11,,https://api.elsevier.com/content/article/PII:S0011224014000042,
4,"Vladimír Hula, Jana Niedobová","The Mediterranean Recluse Spider Loxosceles rufescens (Dufour, 1820): a new invasive for Socotra Island (Yemen)",2020,Rendiconti Lincei. Scienze Fisiche e Naturali,Springer Science and Business Media LLC,https://doi.org/10.1007/s12210-020-00925-7,,944,8/11/2025 21:21,journal-article,10.1007/s12210-020-00925-7,2037-4631,,31,3,719,723,4,0.8,2,2,5,,https://link.springer.com/content/pdf/10.1007/s12210-020-00925-7.pdf,
20,"Martin Bačkor, Bořivoj Klejdus, Ivana Vantová, Jozef Kováčik","Physiological adaptations in the lichens Peltigera rufescens and Cladina arbuscula var. mitis, and the moss Racomitrium lanuginosum to copper-rich substrate",2009,Chemosphere,Elsevier BV,https://doi.org/10.1016/j.chemosphere.2009.06.029,,945,8/11/2025 21:21,journal-article,10.1016/j.chemosphere.2009.06.029,0045-6535,,76,10,1340,1343,20,1.25,5,4,16,,https://api.elsevier.com/content/article/PII:S0045653509007425,
4,"J.B.K. Asiedu, E. Asare-Bedi, K.J. Taah, J.N. Buah",Effect of Pre-Sowing Treatments on Seed Germination and Establishment of Bauhinia rufescens,2011,International Journal of Agricultural Research,Science Alert,https://doi.org/10.3923/ijar.2011.584.592,,946,8/11/2025 21:21,journal-article,10.3923/ijar.2011.584.592,1816-4897,,6,7,584,592,4,0.29,1,4,14,,https://www.scialert.net/fulltext/?doi=ijar.2011.584.592&org=10,
0,"José Luis Buenadicha Huguet, Juan Antonio SánchezNovo, Ángeles Novo Guzmán",Picadura por Loxosceles rufescens (araña parda o del rincón),2012,FMC - Formación Médica Continuada en Atención Primaria,Elsevier BV,https://doi.org/10.1016/s1134-2072(12)70461-9,,947,8/11/2025 21:21,journal-article,10.1016/s1134-2072(12)70461-9,1134-2072,,19,8,517,518,0,0,0,3,13,,https://api.elsevier.com/content/article/PII:S1134207212704619,
25,"Enric Planas, Erin E Saupe, Matheus S Lima-Ribeiro, A Townsend Peterson, Carles Ribera","Ecological niche and phylogeography elucidate complex biogeographic patterns in Loxosceles rufescens (Araneae, Sicariidae) in the Mediterranean Basin",2014,BMC Evolutionary Biology,Springer Science and Business Media LLC,https://doi.org/10.1186/s12862-014-0195-y,,948,8/11/2025 21:21,journal-article,10.1186/s12862-014-0195-y,1471-2148,,14,1,,,25,2.27,5,5,11,,http://link.springer.com/content/pdf/10.1186/s12862-014-0195-y.pdf,
141,"Pierre De Wit, Stephen R. Palumbi",Transcriptome‐wide polymorphisms of red abalone (<i><scp>H</scp>aliotis rufescens</i>) reveal patterns of gene flow and local adaptation,2012,Molecular Ecology,Wiley,https://doi.org/10.1111/mec.12081,,949,8/11/2025 21:21,journal-article,10.1111/mec.12081,0962-1083,,22,11,2884,2897,141,10.85,71,2,13,"Abstract: Global climate change is projected to accelerate during the next century, altering oceanic patterns in temperature, p",https://api.wiley.com/onlinelibrary/tdm/v1/articles/10.1111%2Fmec.12081,
54,"Junpeng Cai, Yun Han, Zhi Wang",Isolation of Vibrio parahaemolyticus from abalone (Haliotis diversicolor supertexta L.) postlarvae associated with mass mortalities,2006,Aquaculture,Elsevier BV,https://doi.org/10.1016/j.aquaculture.2006.03.007,,950,8/11/2025 21:21,journal-article,10.1016/j.aquaculture.2006.03.007,0044-8486,,257,1,161,166,54,2.84,18,3,19,,https://api.elsevier.com/content/article/PII:S0044848606002110,
0,"Xuan Jing, Hui-Yao Zhao, Yan-Na Zheng, Yi-Meng Nie, Li-Bin Ma, Yuan Huang",A Chromosome-Level Genome Assembly and Annotation for the<i>Oecanthus rufescens</i>(Orthoptera: Oecanthidae),2024,Genome Biology and Evolution,Oxford University Press (OUP),https://doi.org/10.1093/gbe/evae145,,951,8/11/2025 21:21,journal-article,10.1093/gbe/evae145,1759-6653,,16,7,,,0,0,0,6,1,"Abstract: Oecanthus is a genus of cricket known for its distinctive chirping and distributed across major zoogeographical regions worldwide. This study focuses on Oecanthus rufescens, and conducts a comprehensive examination of its genome through genome sequencing technologies and bioinformatic analysis. A high-quality chromosome-level genome of O. rufescens was successfully obtained, revealing significant features of its genome structure. The genome size is 877.9 Mb, comprising ten pseudo-chromosomes and 70 other sequences, with a GC content of 41.38% and an N50 value of 157,110,771 bp, indicating a high level of continuity. BUSCO assessment results demonstrate that the genome's integrity and quality are high (of which 96.8% are single-copy and 1.6% are duplicated). Comprehensive genome annotation was also performed, identifying approximately 310 Mb of repetitive sequences, accounting for 35.3% of the total genome sequence, and discovering 15,481 tRNA genes, 4,082 rRNA genes, and 1,212 other noncoding genes. Furthermore, 15,031 protein-coding genes were identified, with BUSCO assessment results showing that 98.4% (of which 96.3% are single-copy and 1.6% are duplicated) of the genes were annotated.",https://academic.oup.com/gbe/advance-article-pdf/doi/10.1093/gbe/evae145/58374209/evae145.pdf,
