Cites,Authors,Title,Year,Source,Publisher,ArticleURL,CitesURL,GSRank,QueryDate,Type,DOI,ISSN,CitationURL,Volume,Issue,StartPage,EndPage,ECC,CitesPerYear,CitesPerAuthor,AuthorCount,Age,Abstract,FullTextURL,RelatedURL
0,,Aimophila rufescens: BirdLife International,2020,IUCN Red List of Threatened Species,IUCN,https://doi.org/10.2305/iucn.uk.2020-3.rlts.t22721294a136948161.en,,322,8/11/2025 21:21,dataset,10.2305/iucn.uk.2020-3.rlts.t22721294a136948161.en,,,,,,,0,0,0,0,5,,,
0,,"Elephantulus rufescens: Rathbun, G.B.",2013,IUCN Red List of Threatened Species,IUCN,https://doi.org/10.2305/iucn.uk.2015-2.rlts.t42664a21289073.en,,323,8/11/2025 21:21,dataset,10.2305/iucn.uk.2015-2.rlts.t42664a21289073.en,,,,,,,0,0,0,0,12,,,
0,"Josep del Hoyo, Andrew Elliott, Jordi Sargatal, David Christie, Eduardo de Juana",Chatham Islands Fernbird (Poodytes rufescens),2020,Birds of the World,Cornell Lab of Ornithology,https://doi.org/10.2173/bow.chifer1.01,,324,8/11/2025 21:21,reference-entry,10.2173/bow.chifer1.01,,,,,,,0,0,0,5,5,,,
0,,Antioxidant and Anticancer Activity of Rhynchosia rufescens (Willd.) DC.,2023,Indian Journal of Biochemistry and Biophysics,CSIR-National Institute of Science Communication and Policy Research (NIScPR),https://doi.org/10.56042/ijbb.v60i11.717,,325,8/11/2025 21:21,journal-article,10.56042/ijbb.v60i11.717,0301-1208,,,,,,0,0,0,0,2,,,
0,,"Ocotea rufescens: Zamora, N.A.",2020,IUCN Red List of Threatened Species,IUCN,https://doi.org/10.2305/iucn.uk.2022-1.rlts.t149469567a162578288.en,,326,8/11/2025 21:21,dataset,10.2305/iucn.uk.2022-1.rlts.t149469567a162578288.en,,,,,,,0,0,0,0,5,,,
0,,Sylvietta rufescens: BirdLife International,2016,IUCN Red List of Threatened Species,IUCN,https://doi.org/10.2305/iucn.uk.2016-3.rlts.t22715140a94441847.en,,327,8/11/2025 21:21,dataset,10.2305/iucn.uk.2016-3.rlts.t22715140a94441847.en,,,,,,,0,0,0,0,9,,,
0,,Myiophobus rufescens: BirdLife International,2016,IUCN Red List of Threatened Species,IUCN,https://doi.org/10.2305/iucn.uk.2016-3.rlts.t103682419a104080823.en,,328,8/11/2025 21:21,dataset,10.2305/iucn.uk.2016-3.rlts.t103682419a104080823.en,,,,,,,0,0,0,0,9,,,
0,,Alaudala rufescens: BirdLife International,2016,IUCN Red List of Threatened Species,IUCN,https://doi.org/10.2305/iucn.uk.2016-3.rlts.t104007058a87491797.en,,329,8/11/2025 21:21,dataset,10.2305/iucn.uk.2016-3.rlts.t104007058a87491797.en,,,,,,,0,0,0,0,9,,,
91,"B. Evans, J. Bartlett, N. Sweijd, P. Cook, N.G. Elliott",Loss of genetic variation at microsatellite loci in hatchery produced abalone in Australia (Haliotis rubra) and South Africa (Haliotis midae),2004,Aquaculture,Elsevier BV,https://doi.org/10.1016/j.aquaculture.2003.09.037,,330,8/11/2025 21:21,journal-article,10.1016/j.aquaculture.2003.09.037,0044-8486,,233,1,109,127,91,4.33,18,5,21,,https://api.elsevier.com/content/article/PII:S0044848603006665,
0,,Cleistanthus rufescens: Energy Development Corporation (EDC),2022,IUCN Red List of Threatened Species,IUCN,https://doi.org/10.2305/iucn.uk.2024-2.rlts.t198049269a203233816.en,,331,8/11/2025 21:21,dataset,10.2305/iucn.uk.2024-2.rlts.t198049269a203233816.en,,,,,,,0,0,0,0,3,,,
20,"Wei-Wei You, Cai-Huan Ke, Xuan Luo, De-Xiang Wang",Divergent selection for shell length in two stocks of small abalone Haliotis diversicolor,2009,Aquaculture Research,Hindawi Limited,https://doi.org/10.1111/j.1365-2109.2009.02376.x,,332,8/11/2025 21:21,journal-article,10.1111/j.1365-2109.2009.02376.x,1355-557X,,41,6,921,929,20,1.25,5,4,16,,https://api.wiley.com/onlinelibrary/tdm/v1/articles/10.1111%2Fj.1365-2109.2009.02376.x,
0,Steve Madge,Rufescent Prinia (Prinia rufescens),2020,Birds of the World,Cornell Lab of Ornithology,https://doi.org/10.2173/bow.rufpri1.01,,333,8/11/2025 21:21,reference-entry,10.2173/bow.rufpri1.01,,,,,,,0,0,0,1,5,,,
2,,"Antimicrobial, antityrosinase and brine shrimp lethality test of Bauhinia rufescens Lam (Fabaceae)",2013,Journal of Coastal Life Medicine,Asian Pacific Journal of Tropical Medicine Press,https://doi.org/10.12980/jclm.1.2013c924,,334,8/11/2025 21:21,journal-article,10.12980/jclm.1.2013c924,2309-5288,,,,,,2,0.17,0,0,12,,http://www.jclmm.com/qk/20132/11.pdf,
0,,Laniocera rufescens: BirdLife International,2016,IUCN Red List of Threatened Species,IUCN,https://doi.org/10.2305/iucn.uk.2016-3.rlts.t22700383a93772156.en,,335,8/11/2025 21:21,dataset,10.2305/iucn.uk.2016-3.rlts.t22700383a93772156.en,,,,,,,0,0,0,0,9,,,
0,,Rhynchotus rufescens: BirdLife International,2012,IUCN Red List of Threatened Species,IUCN,https://doi.org/10.2305/iucn.uk.2012-1.rlts.t22733941a38518698.en,,336,8/11/2025 21:21,dataset,10.2305/iucn.uk.2012-1.rlts.t22733941a38518698.en,,,,,,,0,0,0,0,13,,,
0,,Otus rufescens: BirdLife International,2016,IUCN Red List of Threatened Species,IUCN,https://doi.org/10.2305/iucn.uk.2016-3.rlts.t22688554a93200471.en,,337,8/11/2025 21:21,dataset,10.2305/iucn.uk.2016-3.rlts.t22688554a93200471.en,,,,,,,0,0,0,0,9,,,
0,,Alaudala rufescens: BirdLife International,2022,IUCN Red List of Threatened Species,IUCN,https://doi.org/10.2305/iucn.uk.2022-2.rlts.t216912644a219624294.en,,338,8/11/2025 21:21,dataset,10.2305/iucn.uk.2022-2.rlts.t216912644a219624294.en,,,,,,,0,0,0,0,3,,,
0,,Prinia rufescens: BirdLife International,2016,IUCN Red List of Threatened Species,IUCN,https://doi.org/10.2305/iucn.uk.2016-3.rlts.t22713584a94381160.en,,339,8/11/2025 21:21,dataset,10.2305/iucn.uk.2016-3.rlts.t22713584a94381160.en,,,,,,,0,0,0,0,9,,,
13,"Xuan Luo, Caihuan Ke, Weiwei You, Dexiang Wang",Factors Affecting the Fertilization Success in Laboratory Hybridization between<i>Haliotis discus hannai</i>and<i>Haliotis gigantea</i>,2010,Journal of Shellfish Research,National Shellfisheries Association,https://doi.org/10.2983/035.029.0310,,340,8/11/2025 21:21,journal-article,10.2983/035.029.0310,0730-8000,,29,3,621,625,13,0.87,3,4,15,,,
0,Jan-Åke Nilsson,"Decision letter for ""Drivers of partial migration in the reddish egret &lt;i&gt;Egretta rufescens&lt;/i&gt;""",2023,,Wiley,https://doi.org/10.1111/jav.03133/v1/decision1,,341,8/11/2025 21:21,peer-review,10.1111/jav.03133/v1/decision1,,,,,,,0,0,0,1,2,,,
0,,Bolitoglossa rufescens: IUCN SSC Amphibian Specialist Group,2019,IUCN Red List of Threatened Species,IUCN,https://doi.org/10.2305/iucn.uk.2020-3.rlts.t50928774a50928633.en,,342,8/11/2025 21:21,dataset,10.2305/iucn.uk.2020-3.rlts.t50928774a50928633.en,,,,,,,0,0,0,0,6,,,
2,"Buzz Owen, Wilco Regter, Kirsten Van Laethem","A Review of the Haliotis of Yemen and Oman with Description of a New Species, Haliotis arabiensis, from Oman and United Arab Emirates",2016,The Festivus,The San Diego Shell Club,https://doi.org/10.54173/f48284,,343,8/11/2025 21:21,journal-article,10.54173/f48284,0738-9388,,48,2,84,92,2,0.22,1,3,9,"A new species, Haliotis arabiensis from Oman and United Arab Emirates is described and illustrated with a high resolution photo plate. Three taxa found along the southern and eastern Arabian Peninsula, two in Oman and the United Arab Emirates, Haliotis mariae W. Wood, 1828, and Haliotis unilateralis Lamarck, 1822, and one in Yemen, Haliotis rugosa multiperforata Reeve, 1846, are reviewed and compared with the new species. Three additional plates illustrate the other southern and eastern Arabian Peninsula Haliotis. A fifth plate provides a differential diagnosis of the four taxa.",,
0,,"Actinodaphne rufescens: de Kok, R.",2020,IUCN Red List of Threatened Species,IUCN,https://doi.org/10.2305/iucn.uk.2021-1.rlts.t178343614a178343618.en,,344,8/11/2025 21:21,dataset,10.2305/iucn.uk.2021-1.rlts.t178343614a178343618.en,,,,,,,0,0,0,0,5,,,
8,Steve Edwards,Assessment of the physiological effect of altered salinity on greenlip (<i>Haliotis laevigata</i> ) and blacklip (<i>Haliotis rubra</i> ) abalone using respirometry,2003,Aquaculture Research,Hindawi Limited,https://doi.org/10.1046/j.1365-2109.2003.00943.x,,345,8/11/2025 21:21,journal-article,10.1046/j.1365-2109.2003.00943.x,1355-557X,,34,14,1361,1365,8,0.36,8,1,22,,https://api.wiley.com/onlinelibrary/tdm/v1/articles/10.1046%2Fj.1365-2109.2003.00943.x,
63,"Celia Hooper, Rob Day, Ron Slocombe, Kirsten Benkendorff, Judith Handlinger, Julien Goulias","Effects of severe heat stress on immune function, biochemistry and histopathology in farmed Australian abalone (hybrid Haliotis laevigata×Haliotis rubra)",2014,Aquaculture,Elsevier BV,https://doi.org/10.1016/j.aquaculture.2014.03.032,,346,8/11/2025 21:21,journal-article,10.1016/j.aquaculture.2014.03.032,0044-8486,,432,,26,37,63,5.73,11,6,11,,https://api.elsevier.com/content/article/PII:S0044848614001355,
17,"J. Sales, P.J. Britz",Apparent and true availability of amino acids from common feed ingredients for South African abalone (<i>Haliotis midae</i> L.),2003,Aquaculture Nutrition,Hindawi Limited,https://doi.org/10.1046/j.1365-2095.2003.02371.x,,347,8/11/2025 21:21,journal-article,10.1046/j.1365-2095.2003.02371.x,1353-5773,,9,1,55,64,17,0.77,9,2,22,,https://api.wiley.com/onlinelibrary/tdm/v1/articles/10.1046%2Fj.1365-2095.2003.02371.x,
0,"James A Kushlan, James A Hancock",Reddish Egret Egretita rufescens,2005,Herons,Oxford University PressOxford,https://doi.org/10.1093/oso/9780198549819.003.0021,,348,8/11/2025 21:21,book-chapter,10.1093/oso/9780198549819.003.0021,,,,,150,155,0,0,0,2,20,"Abstract: High dispersal tendancy, ability to breed in year one, high nesting success, potentially low chick mortality, low first year mortality but relatively short life span suggest that the Cattle Egret is indeed the “r” strategist among herons, a species well adapted to exploiting changing environments through population increases. The Cattle Egret is the heron success story of the twentieth century. It has expanded across the world, responding to human habitat change and is becoming an integral part of the human landscape nearly worldwide.",https://academic.oup.com/book/chapter-pdf/52357815/isbn-9780198549819-book-part-21.pdf,
0,,Bowdleria rufescens: BirdLife International,2012,IUCN Red List of Threatened Species,IUCN,https://doi.org/10.2305/iucn.uk.2012-1.rlts.t22728902a39885600.en,,349,8/11/2025 21:21,dataset,10.2305/iucn.uk.2012-1.rlts.t22728902a39885600.en,,,,,,,0,0,0,0,13,,,
1,"Yi Wang, Xingze Wang, Yang Gan, Miaoqin Huang, Weiwei You, Xuan Luo, Caihuan Ke",Autotriploid and allotriploid abalone larvae (Haliotis discus hannai and H. discus hannai ♀ × Haliotis fulgens ♂) produced by two chemical methods,2021,Aquaculture Reports,Elsevier BV,https://doi.org/10.1016/j.aqrep.2021.100769,,350,8/11/2025 21:21,journal-article,10.1016/j.aqrep.2021.100769,2352-5134,,20,,100769,100769,1,0.25,0,7,4,,https://api.elsevier.com/content/article/PII:S235251342100185X,
0,"ทิพวรรณ ตัณฑวณิช, วีณา เคยพุดซา",ประสิทธิภาพของยาต้านจุลชีพในการยับยั้งเชื้อแบคทีเรีย Vibrio spp. ที่ทำให้เกิดโรคในหอยเป๋าฮื้อไทยชนิด Haliotis asinina LINNAEUS 1758,2009,,สถาบันวิจัยทรัพยากรทางน้ำ จุฬาลงกรณ์มหาวิทยาลัย,https://doi.org/10.58837/chula.res.2009.82,,351,8/11/2025 21:21,report,10.58837/chula.res.2009.82,,,,,,,0,0,0,2,16,"ศึกษาประสิทธิภาพของยาต้านจุลชีพในการยับยั้งการเจริญเติบโตของเชื้อแบคทีเรีย Vibrio spp. ที่ทำให้เกิดโรคในหอยเป๋าฮื้อไทย ที่มีขนาดความยาวเปลือก 2.27±0.02 เซนติเมตร และมีน้ำหนักตัวเฉลี่ย 2.77±0.06 กรัม และแสดงวิการโรคบริเวณเนื้อเยื่อปิดอวัยวะภายในฉีกขาด กล้ามเนื้อเท้าเป็นแผลวงสีขาวและไม่เกาะพื้นผิว โดยทำการแยกเชื้อวิบริโอจากอวัยวะต่างๆ ได้แก่ ตับ/ตับอ่อน (Hepatopancreas), อวัยวะสืบพันธุ์ (Gonad), น้ำเลือด (Hemolymph), กล้ามเนื้อเท้า (Foot Muscle) และเนื้อเยื่อปิดอวัยวะภายใน มาเพาะเลี้ยงและทำการพิสูจน์เชื้อเพื่อแยกชนิด (Identification) โดยการทดสอบคุณสมบัติต่างๆทางชีวเคมีด้วยชุดทดสอบ API 20E พบเชื้อแบคทีเรีย Vibrio spp. ทั้งหมด 3 ชนิด ได้แก่ V. cholerae, V. fluvialis และ V. vulnificus นำเชื้อแบคทีเรีย Vibrio spp. ที่พบมาทดสอบความไวต่อยาต้านจุลชีพทั้ง 13 ชนิด โดยวิธี Agar Disc Diffusion Method บนอาหารเลี้ยงเชื้อ Meuller Hilton Agar พบว่า chloramphenicol และ nalidixic acid สามารถยับยั้งเชื้อแบคทีเรีย Vibrio spp. ทั้ง 3 ชนิดได้ 100% รองลงมา ได้แก่ doxycycline hydrochloride, furazolidone, norfloxacin, oxolinic acid, ciprofloxacin, enrofloxacin, oxytetracycline, tetracycline และ sulfadimethoxine ตามลำดับ ส่วน erythromycin และ novobiocin นั้นไม่มีฤทธิ์ในการยับยั้งเชื้อแบคทีเรีย Vibrio spp. ทั้ง 3 ชนิดได้ จากนั้นเลือกยาต้านจุลชีพมาเพียง 5 ชนิด ได้แก่ oxytetracycline, sulfadimethoxine, enrofloxacin, tetracycline และ oxolinic acid เพื่อศึกษาประสิทธิภาพของยาต้านจุลชีพในการยับยั้งและกำจัดเชื้อ V. cholerae, V. fluvialis และ V. vulnificus โดยวิธี Broth Dilution Method พบว่า oxolinic acid มีประสิทธิภาพในการยับยั้งและกำจัด V. cholerae และ V. fluvialis สูงสุด (MIC ≥ 0.125, MBC ≥ 16 ppm และ MIC ≥ 0.125, MBC ≥ 16 ppm ตามลำดับ) ส่วน enrof-loxacin มีประสิทธิภาพในการยับยั้งและกำจัด V. vulnificus สูงสุด (MIC ≥ 0.50, MBC ≥ 32 ppm) ส่วน sulfadimethoxine มีประสิทธิภาพในการยับยั้งและกำจัดเชื้อแบคทีเรีย Vibrio spp. ทั้ง 3 ชนิดได้ต่ำสุดการศึกษาเหนี่ยวนำให้เกิดโรควิบริโอซีสโดยการฉีดเชื้อแบคทีเรีย Vibrio spp. เข้ากล้ามเนื้อเท้าหอยเป๋าฮื้อ พบว่า ค่า LD50 ของเชื้อ V. cholerae (1.04 x 107 CFU/ml.) มีค่าต่ำกว่า V. fluvialis (1.87 x 107 CFU/ml.) และ V. vulnificus (2.87 x 109 CFU/ml.) ซึ่งแสดงว่า V. cholerae มีความรุนแรงในการก่อโรคมากที่สุด จึงเลือก V. cholerae มาเหนี่ยวนำให้เกิดโรควิบริโอซีส (vibriosis) ในหอยเป๋าฮื้อ แล้วทำการศึกษาประสิทธิภาพของยาต้านจุลชีพทั้ง 5 ชนิดในการรักษาโรควิบริโอซีสในหอยเป๋าฮื้อ โดยยาแต่ละชนิดใช้ 3 ขนาด ให้ยาด้วยวิธีการแช่ต่อเนื่องเป็นเวลา 7 วัน พบว่า ความเข้มข้นของยาต้านจุลชีพที่เหมาะสมต่อการรักษาโรคในหอยเป๋าฮื้อของ oxytetracycline, sulfadimethoxine, enrofloxacin, tetracycline และ oxolinic acid มีค่าเป็น 50, 20, 5, 10 และ 1 ppm ตามลำดับ สำหรับอัตราการรอดชีวิตสูงสุดของหอยเป๋าฮื้อมีค่า 66.67±6.67%, 46.67±3.33%, 53.33±3.33%, 43.33±3.33% และ 43.33±3.33% ตามลำดับ",,
6,"Cheng-Ting Huang, Nguyen Phuoc Vinh, Yi-Ting Chen, Tung-Ta Liang, Fan-Hua Nan, Ping-Chung Liu",Improving productivity management of commercial abalone Haliotis diversicolor supertexta and Haliotis discus hannai aquaculture in Taiwan: A bioeconomic analysis,2019,Aquaculture,Elsevier BV,https://doi.org/10.1016/j.aquaculture.2019.734323,,352,8/11/2025 21:21,journal-article,10.1016/j.aquaculture.2019.734323,0044-8486,,512,,734323,734323,6,1,1,6,6,,https://api.elsevier.com/content/article/PII:S0044848618320064,
0,,Argya rufescens: BirdLife International,2021,IUCN Red List of Threatened Species,IUCN,https://doi.org/10.2305/iucn.uk.2022-1.rlts.t22716406a209749372.en,,353,8/11/2025 21:21,dataset,10.2305/iucn.uk.2022-1.rlts.t22716406a209749372.en,,,,,,,0,0,0,0,4,,,
0,,Laniocera rufescens: BirdLife International,2022,IUCN Red List of Threatened Species,IUCN,https://doi.org/10.2305/iucn.uk.2022-2.rlts.t22700383a137909445.en,,354,8/11/2025 21:21,dataset,10.2305/iucn.uk.2022-2.rlts.t22700383a137909445.en,,,,,,,0,0,0,0,3,,,
0,,Prinia rufescens: BirdLife International,2012,IUCN Red List of Threatened Species,IUCN,https://doi.org/10.2305/iucn.uk.2012-1.rlts.t22713584a39463590.en,,355,8/11/2025 21:21,dataset,10.2305/iucn.uk.2012-1.rlts.t22713584a39463590.en,,,,,,,0,0,0,0,13,,,
0,,"Pluchea rufescens: Faranirina, L.",2016,IUCN Red List of Threatened Species,IUCN,https://doi.org/10.2305/iucn.uk.2020-3.rlts.t88502709a177780537.en,,356,8/11/2025 21:21,dataset,10.2305/iucn.uk.2020-3.rlts.t88502709a177780537.en,,,,,,,0,0,0,0,9,,,
0,,Illadopsis rufescens: BirdLife International,2012,IUCN Red List of Threatened Species,IUCN,https://doi.org/10.2305/iucn.uk.2012-1.rlts.t22715899a39576647.en,,357,8/11/2025 21:21,dataset,10.2305/iucn.uk.2012-1.rlts.t22715899a39576647.en,,,,,,,0,0,0,0,13,,,
0,,Pelecanus rufescens: BirdLife International,2024,IUCN Red List of Threatened Species,IUCN,https://doi.org/10.2305/iucn.uk.2024-2.rlts.t22697595a265010010.en,,358,8/11/2025 21:21,dataset,10.2305/iucn.uk.2024-2.rlts.t22697595a265010010.en,,,,,,,0,0,0,0,1,,,
0,,"Hylophorbus rufescens: Stephen Richards, Rainer Günther",2004,IUCN Red List of Threatened Species,IUCN,https://doi.org/10.2305/iucn.uk.2004.rlts.t57827a11690517.en,,359,8/11/2025 21:21,dataset,10.2305/iucn.uk.2004.rlts.t57827a11690517.en,,,,,,,0,0,0,0,21,,,
0,,"Eriosema rufescens: Braun, K.",2023,IUCN Red List of Threatened Species,IUCN,https://doi.org/10.2305/iucn.uk.2024-1.rlts.t221343844a221361802.en,,360,8/11/2025 21:21,dataset,10.2305/iucn.uk.2024-1.rlts.t221343844a221361802.en,,,,,,,0,0,0,0,2,,,
0,,Aimophila rufescens: BirdLife International,2012,IUCN Red List of Threatened Species,IUCN,https://doi.org/10.2305/iucn.uk.2012-1.rlts.t22721294a39945955.en,,361,8/11/2025 21:21,dataset,10.2305/iucn.uk.2012-1.rlts.t22721294a39945955.en,,,,,,,0,0,0,0,13,,,
0,,Atrichornis rufescens: BirdLife International,2012,IUCN Red List of Threatened Species,IUCN,https://doi.org/10.2305/iucn.uk.2012-1.rlts.t22703608a39249386.en,,362,8/11/2025 21:21,dataset,10.2305/iucn.uk.2012-1.rlts.t22703608a39249386.en,,,,,,,0,0,0,0,13,,,
0,,"Coendou rufescens: Tirira, D.",2016,IUCN Red List of Threatened Species,IUCN,https://doi.org/10.2305/iucn.uk.2016-2.rlts.t7010a22213241.en,,363,8/11/2025 21:21,dataset,10.2305/iucn.uk.2016-2.rlts.t7010a22213241.en,,,,,,,0,0,0,0,9,,,
14,"James O Harris, Christopher M Burke, Stephen J Edwards, Deon R Johns","Effects of oxygen supersaturation and temperature on juvenile greenlip, Haliotis laevigata Donovan, and blacklip, Haliotis rubra Leach, abalone",2005,Aquaculture Research,Hindawi Limited,https://doi.org/10.1111/j.1365-2109.2005.01360.x,,364,8/11/2025 21:21,journal-article,10.1111/j.1365-2109.2005.01360.x,1355-557X,,36,14,1400,1407,14,0.7,4,4,20,,https://api.wiley.com/onlinelibrary/tdm/v1/articles/10.1111%2Fj.1365-2109.2005.01360.x,
0,Jan-Åke Nilsson,"Decision letter for ""Drivers of partial migration in the reddish egret &lt;i&gt;Egretta rufescens&lt;/i&gt;""",2023,,Wiley,https://doi.org/10.1111/jav.03133/v3/decision1,,365,8/11/2025 21:21,peer-review,10.1111/jav.03133/v3/decision1,,,,,,,0,0,0,1,2,,,
0,,"Ochotona rufescens: Smith, A.T. &amp; Johnston, C.",2016,IUCN Red List of Threatened Species,IUCN,https://doi.org/10.2305/iucn.uk.2016-3.rlts.t41269a45184750.en,,366,8/11/2025 21:21,dataset,10.2305/iucn.uk.2016-3.rlts.t41269a45184750.en,,,,,,,0,0,0,0,9,,,
0,,Chiromantis rufescens: IUCN SSC Amphibian Specialist Group,2013,IUCN Red List of Threatened Species,IUCN,https://doi.org/10.2305/iucn.uk.2013-2.rlts.t58800a18407175.en,,367,8/11/2025 21:21,dataset,10.2305/iucn.uk.2013-2.rlts.t58800a18407175.en,,,,,,,0,0,0,0,12,,,
6,"Xuan Luo, Caihuan Ke, Weiwei You, Dexiang Wang, Fei Chen","Aflp Analysis of Populations of<i>Haliotis Discus Hannai</i>,<i>Haliotis gigantea</i>, and Their Hybrids",2010,Journal of Shellfish Research,National Shellfisheries Association,https://doi.org/10.2983/035.029.0326,,368,8/11/2025 21:21,journal-article,10.2983/035.029.0326,0730-8000,,29,3,731,734,6,0.4,1,5,15,,,
0,David Pearson,Cape Crombec (Sylvietta rufescens),2020,Birds of the World,Cornell Lab of Ornithology,https://doi.org/10.2173/bow.capcro1.01,,369,8/11/2025 21:21,reference-entry,10.2173/bow.capcro1.01,,,,,,,0,0,0,1,5,,,
99,"C Hooper, P Hardy‐Smith, J Handlinger",Ganglioneuritis causing high mortalities in farmed Australian abalone (<i>Haliotis laevigata</i> and <i>Haliotis rubra</i>),2007,Australian Veterinary Journal,Wiley,https://doi.org/10.1111/j.1751-0813.2007.00155.x,,370,8/11/2025 21:21,journal-article,10.1111/j.1751-0813.2007.00155.x,0005-0423,,85,5,188,193,99,5.5,33,3,18,,https://api.wiley.com/onlinelibrary/tdm/v1/articles/10.1111%2Fj.1751-0813.2007.00155.x,
0,,"Timonius rufescens: Jimbo, T. &amp; Kipiro, W.",2020,IUCN Red List of Threatened Species,IUCN,https://doi.org/10.2305/iucn.uk.2021-2.rlts.t189077216a189758807.en,,371,8/11/2025 21:21,dataset,10.2305/iucn.uk.2021-2.rlts.t189077216a189758807.en,,,,,,,0,0,0,0,5,,,
0,,Minervarya rufescens: IUCN SSC Amphibian Specialist Group,2021,IUCN Red List of Threatened Species,IUCN,https://doi.org/10.2305/iucn.uk.2023-1.rlts.t121371211a121371889.en,,372,8/11/2025 21:21,dataset,10.2305/iucn.uk.2023-1.rlts.t121371211a121371889.en,,,,,,,0,0,0,0,4,,,
0,,"Oxalis rufescens: Quintana, C. &amp; Pitman, N.",2004,IUCN Red List of Threatened Species,IUCN,https://doi.org/10.2305/iucn.uk.2004.rlts.t45537a11003785.en,,373,8/11/2025 21:21,dataset,10.2305/iucn.uk.2004.rlts.t45537a11003785.en,,,,,,,0,0,0,0,21,,,
0,,"Eleutherodactylus rufescens: Georgina Santos-Barrera, Luis Canseco-Márquez",2004,IUCN Red List of Threatened Species,IUCN,https://doi.org/10.2305/iucn.uk.2004.rlts.t56930a11556373.en,,374,8/11/2025 21:21,dataset,10.2305/iucn.uk.2004.rlts.t56930a11556373.en,,,,,,,0,0,0,0,21,,,
0,,Hylophorbus rufescens: IUCN SSC Amphibian Specialist Group,2019,IUCN Red List of Threatened Species,IUCN,https://doi.org/10.2305/iucn.uk.2020-3.rlts.t57827a152550734.en,,375,8/11/2025 21:21,dataset,10.2305/iucn.uk.2020-3.rlts.t57827a152550734.en,,,,,,,0,0,0,0,6,,,
1,"Donald L. Dahlsten, Leonard A. Brennan, D. Archibald McCallum, Sandra L. L. Gaunt",Chestnut-backed Chickadee (Poecile rufescens),2002,Birds of North America (print),"The Academy of Natural Sciences, Philadelphia, and The American Ornithologists' Union, Washington D.C",https://doi.org/10.2173/tbna.689.p,,376,8/11/2025 21:21,reference-entry,10.2173/tbna.689.p,,,,,,,1,0.04,0,4,23,,,
7,"Jin Han Bae, Sung Ho Yoon, Sun Young Lim",A comparative of heavy metal contents and biochemical characteristics of Japanese (Haliotis discus) and Korean abalone (Haliotis discus hannai),2011,Food Science and Biotechnology,Springer Science and Business Media LLC,https://doi.org/10.1007/s10068-011-0038-1,,377,8/11/2025 21:21,journal-article,10.1007/s10068-011-0038-1,1226-7708,,20,1,273,276,7,0.5,2,3,14,,http://link.springer.com/content/pdf/10.1007/s10068-011-0038-1.pdf,
0,Phil Gregory,Vogelkop Scrubwren (Sericornis rufescens),2020,Birds of the World,Cornell Lab of Ornithology,https://doi.org/10.2173/bow.vogscr1.01,,378,8/11/2025 21:21,reference-entry,10.2173/bow.vogscr1.01,,,,,,,0,0,0,1,5,,,
0,,WITHDRAWN: Bamboo as Potential Substrate for Sea Cage Culture of Abalone Haliotis asinina,2023,,Research Square Platform LLC,https://doi.org/10.21203/rs.3.rs-2990994/v2,,379,8/11/2025 21:21,posted-content,10.21203/rs.3.rs-2990994/v2,,,,,,,0,0,0,0,2,"Abstract: The full text of this preprint has been withdrawn by the authors due to author disagreement with the posting of the preprint. Therefore, the authors do not wish this work to be cited as a reference. Questions should be directed to the corresponding author.",https://www.researchsquare.com/article/rs-2990994/v2,
0,,"Rhagomys rufescens: Bergallo, H. &amp; Percequillo, A.",2016,IUCN Red List of Threatened Species,IUCN,https://doi.org/10.2305/iucn.uk.2019-1.rlts.t19454a22353755.en,,380,8/11/2025 21:21,dataset,10.2305/iucn.uk.2019-1.rlts.t19454a22353755.en,,,,,,,0,0,0,0,9,,,
