Cites,Authors,Title,Year,Source,Publisher,ArticleURL,CitesURL,GSRank,QueryDate,Type,DOI,ISSN,CitationURL,Volume,Issue,StartPage,EndPage,ECC,CitesPerYear,CitesPerAuthor,AuthorCount,Age,Abstract,FullTextURL,RelatedURL
0,"Dan-Dan Zhang, Yu-Yan Yue, Meng-Di Zhang, Zong-Jun Du","Halocynthiibacter halioticoli sp. nov., isolated from the abalone Haliotis discus hannai",2022,,Research Square Platform LLC,https://doi.org/10.21203/rs.3.rs-2229936/v1,,645,8/11/2025 21:21,posted-content,10.21203/rs.3.rs-2229936/v1,,,,,,,0,0,0,4,3,"Abstract: A Gram-stain-negative, rod-shaped, glide, non-flagellated, and facultatively aerobic bacterial strain, designated as Z654",https://www.researchsquare.com/article/rs-2229936/v1,
0,,Cupania rufescens: Botanic Gardens Conservation International (BGCI) &amp; IUCN SSC Global Tree Specialist Group,2018,IUCN Red List of Threatened Species,IUCN,https://doi.org/10.2305/iucn.uk.2019-2.rlts.t146784990a146784992.en,,646,8/11/2025 21:21,dataset,10.2305/iucn.uk.2019-2.rlts.t146784990a146784992.en,,,,,,,0,0,0,0,7,,,
2,"Maeng-Hyun Son, Byeong-Hak Kim, Suji Kim, Jung Sick Lee","Histological Indicator Change of the Abalone, Haliotis discus hannai Chronic Exposed to Zinc Chloride (ZnCl<sub>2</sub>)",2015,The Korean Journal of Malacology,The Malacological Society of Korea,https://doi.org/10.9710/kjm.2015.31.3.195,,647,8/11/2025 21:21,journal-article,10.9710/kjm.2015.31.3.195,1225-3480,,31,3,195,201,2,0.2,1,4,10,,http://ocean.kisti.re.kr/downfile/crosscheck/tmsk/JAKO201531362063311.pdf,
0,"Charles Thomas Parker, George M Garrity",Exemplar Abstract for Paraferrimonas haliotis Huang et al. 2017.,2017,The NamesforLife Abstracts,"NamesforLife, LLC",https://doi.org/10.1601/ex.31085,,648,8/11/2025 21:21,dataset,10.1601/ex.31085,,,,,,,0,0,0,2,8,,,
0,"Charles Thomas Parker, George M Garrity",Nomenclature Abstract for Ruegeria haliotis Cao et al. 2021.,2021,The NamesforLife Abstracts,"NamesforLife, LLC",https://doi.org/10.1601/nm.40803,,649,8/11/2025 21:21,dataset,10.1601/nm.40803,,,,,,,0,0,0,2,4,,,
0,Zhongbao Li,The Genetic Diversity and Differentiation of Haliotis Ovina by AFLP,2009,2009 International Conference on Environmental Science and Information Application Technology,IEEE,https://doi.org/10.1109/esiat.2009.406,,650,8/11/2025 21:21,proceedings-article,10.1109/esiat.2009.406,,,,,206,209,0,0,0,1,16,,http://xplorestaging.ieee.org/ielx5/5199613/5200042/05200100.pdf?arnumber=5200100,
5,"P. David Vega-García, Alejandra Piñón-Gimate, Nurenskaya Vélez-Arellano, Salvador E. Lluch-Cota","Differences in Diet of Green (<i>Haliotis fulgens</i>) and Pink (<i>Haliotis corrugata</i>) Wild Abalone along the Pacific Coast of the Baja California Peninsula, Using Stable Isotope Analyses",2015,Journal of Shellfish Research,National Shellfisheries Association,https://doi.org/10.2983/035.034.0317,,651,8/11/2025 21:21,journal-article,10.2983/035.034.0317,0730-8000,,34,3,879,884,5,0.5,1,4,10,,,
0,,Conostegia rufescens: Botanic Gardens Conservation International (BGCI) &amp; IUCN SSC Global Tree Specialist Group,2018,IUCN Red List of Threatened Species,IUCN,https://doi.org/10.2305/iucn.uk.2019-2.rlts.t150000712a150000714.en,,652,8/11/2025 21:21,dataset,10.2305/iucn.uk.2019-2.rlts.t150000712a150000714.en,,,,,,,0,0,0,0,7,,,
0,,"Haliotis cracherodii: Peters, H. &amp; Rogers-Bennett, L.",2021,IUCN Red List of Threatened Species,IUCN,https://doi.org/10.2305/iucn.uk.2021-3.rlts.t41880a78775277.en,,653,8/11/2025 21:21,dataset,10.2305/iucn.uk.2021-3.rlts.t41880a78775277.en,,,,,,,0,0,0,0,4,,,
0,"Nicole Phillips, Jeffrey Shima",Differential effects of suspended sediments on larval survival and settlement of New Zealand urchins Evechinus chloroticus and abalone Haliotis iris,2020,,Victoria University of Wellington Library,https://doi.org/10.26686/wgtn.13012997,,654,8/11/2025 21:21,posted-content,10.26686/wgtn.13012997,,,,,,,0,0,0,2,5,"Larvae of marine organisms play an important role in the dynamics of populations, are generally sensitive to environmental stressors, and vary dramatically among species in life history traits. We examined the effects of suspended sediments from terrestrial runoff on larval development, survival, and settlement of New Zealand sea urchins Evechinus chloroticus and abalone Haliotis iris. Larval urchins and abalone were reared under 5 suspended sediment regimes (variable concentrations and timing of exposure, benchmarked against nearby field conditions), and in the absence of sediments. Stage specific per capita mortality rates of urchin larvae increased with concentrations of suspended sediments, and generally, these rates (and the sensitivity of urchin larvae to sediments) decreased with age. Mortality rates of abalone similarly increased in response to sediment concentrations, although older larvae continued to incur high losses when exposed to sediments. Mortality rates of both abalone and urchins increased in response to acute exposure to sediments early in development. For urchins, this effect was immediate and coincident only with exposure to sediments, whereas elevated mortality rates persisted well after the removal of sediments for abalone. Cumulative survival to competency was similar among species and generally decreased with exposure time and/or concentration of sediments. Urchins were twice as likely to settle and metamorphose as abalone but patterns were not related to larval sediment regime for either species. The strong species specific responses to suspended sediments we observe may greatly alter patterns of larval connectivity in marine meta-communities. © Inter-Research 2006.",,
1,"Bo Seong Kim, Sung Joo Yi, Se Myung Hwang, Mu Kun Lee, Young Jin Park, Kyo Jung Song, Min Do Huh",Myopathy in Clinically Healthy Cultured Abalone Haliotis discus hannai,2014,Korean Journal of Fisheries and Aquatic Sciences,The Korean Society of Fisheries and Aquatic Science,https://doi.org/10.5657/kfas.2014.0174,,655,8/11/2025 21:21,journal-article,10.5657/kfas.2014.0174,0374-8111,,47,2,174,178,1,0.09,0,7,11,,http://ocean.kisti.re.kr/downfile/crosscheck/kofis/JAKO201415640235044.pdf,
0,,Bauhinia rufescens: Botanic Gardens Conservation International (BGCI) &amp; IUCN SSC Global Tree Specialist Group,2018,IUCN Red List of Threatened Species,IUCN,https://doi.org/10.2305/iucn.uk.2019-2.rlts.t144318550a149013844.en,,656,8/11/2025 21:21,dataset,10.2305/iucn.uk.2019-2.rlts.t144318550a149013844.en,,,,,,,0,0,0,0,7,,,
45,"Masashi Sekino, Motoyuki Hara",Linkage Maps for the Pacific Abalone (Genus Haliotis) Based on Microsatellite DNA Markers,2007,Genetics,Oxford University Press (OUP),https://doi.org/10.1534/genetics.106.065839,,657,8/11/2025 21:21,journal-article,10.1534/genetics.106.065839,1943-2631,,175,2,945,958,45,2.5,23,2,18,"Abstract: This study presents linkage maps for the Pacific abalone (Haliotis discus hannai) based on 180 microsatellite DNA markers. Linkage mapping was performed using three F1 outbred families, and a composite linkage map for each sex was generated by incorporating map information from the multiple families. A total of 160 markers are placed on the consolidated female map and 167 markers on the male map. The numbers of linkage groups in the composite female and male maps are 19 and 18, respectively; however, by aligning the two maps, 18 linkage groups are formed, which are consistent with the haploid chromosome number of H. discus hannai. The female map spans 888.1 cM (Kosambi) with an average spacing of 6.3 cM; the male map spans 702.4 cM with an average spacing of 4.7 cM. However, we encountered several linkage groups that show a high level of heterogeneity in recombination rate between families even within the same sex, which reduces the precision of the consolidated maps. Nevertheless, we suggest that the composite maps are of significant potential use as a scaffold to further extend the coverage of the H. discus hannai genome with additional markers.",https://academic.oup.com/genetics/article-pdf/175/2/945/46750260/genetics0945.pdf,
0,"Andrew Elliott, David Christie, Francesc Jutglar, Ernest Garcia, Guy M. Kirwan",Pink-backed Pelican (Pelecanus rufescens),2020,Birds of the World,Cornell Lab of Ornithology,https://doi.org/10.2173/bow.pibpel1.01,,658,8/11/2025 21:21,reference-entry,10.2173/bow.pibpel1.01,,,,,,,0,0,0,5,5,,,
0,Mr Endryawan,ANALISIS PERKEMBANGAN DAN ELASTISITAS TRANSMISI HARGA ABALON (HALIOTIS ASININA) DI KABUPATEN BUTON,2020,Quantitative Economics Journal,State University of Medan,https://doi.org/10.24114/qej.v4i2.17464,,659,8/11/2025 21:21,journal-article,10.24114/qej.v4i2.17464,2089-7995,,4,2,,,0,0,0,1,5,"This study aims to analyze the prize development and the price transmission elasticity of abalone in Buton Regency. This study was conducted in June – July 2015 with a survey method. Analysis of price developments and elasticity of price transmission is done by a simple linear regression model. The results showed that each added one period, abalone prices decreased by Rp. 9501 each kilogram. Pricetransmission elasticity show in the level consumers prices has been not fully transmitted to the level of fisherman with vale ofelasticityis 0,11 indicated that when the selling pricein the level consumers increased by 1% then the selling pricein the levelfisherman will increase of 0,11%, or moere easly can be defined that if the selling pricein the level consumers increase, the selling pricein the levelfisherman will also be increase.",https://jurnal.unimed.ac.id/2012/index.php/qe/article/viewFile/17464/13054,
6,"Abdul Lathiff Inamul Hassan, Thomas S. Mock, Kieren Searle, Melissa M. Rocker, Giovanni M. Turchini, David S. Francis",Growth performance and feed utilisation of Australian hybrid abalone (<i>Haliotis rubra</i> × <i>Haliotis laevigata</i>) fed increasing dietary protein levels at three water temperatures,2023,British Journal of Nutrition,Cambridge University Press (CUP),https://doi.org/10.1017/s0007114523002519,,660,8/11/2025 21:21,journal-article,10.1017/s0007114523002519,0007-1145,,131,6,944,955,6,3,1,6,2,"Abstract: Determining the macronutrient requirements for commercially valuable aquaculture species remains crucial for maximising production efficiency. Yet, such information is lacking for Australian hybrid abalone (",https://www.cambridge.org/core/services/aop-cambridge-core/content/view/S0007114523002519,
0,"Guy M. Kirwan, Andrew Farnsworth, Josep del Hoyo, Daniel J. Lebbin, Nigel Collar, Peter F. D. Boesman",Rufescent Flycatcher (Myiophobus rufescens),2022,Birds of the World,Cornell Lab of Ornithology,https://doi.org/10.2173/bow.brcfly3.01,,661,8/11/2025 21:21,reference-entry,10.2173/bow.brcfly3.01,,,,,,,0,0,0,6,3,,,
0,"Charles Thomas Parker, George M Garrity",Nomenclature Abstract for Formosa haliotis Tanaka et al. 2015.,2015,The NamesforLife Abstracts,"NamesforLife, LLC",https://doi.org/10.1601/nm.27831,,662,8/11/2025 21:21,dataset,10.1601/nm.27831,,,,,,,0,0,0,2,10,,,
33,"Jie Lu, Jianghua Feng, Shuhui Cai, Zhong Chen",Metabolomic responses of Haliotis diversicolor to organotin compounds,2017,Chemosphere,Elsevier BV,https://doi.org/10.1016/j.chemosphere.2016.10.124,,663,8/11/2025 21:21,journal-article,10.1016/j.chemosphere.2016.10.124,0045-6535,,168,,860,869,33,4.13,8,4,8,,https://api.elsevier.com/content/article/PII:S0045653516315156,
2,"Steffen Rehbein, D. Hamel",A note on the relationship between fecal larval excretion and Protostrongylus rufescens lungworm burden in sheep,2022,Parasitology Research,Springer Science and Business Media LLC,https://doi.org/10.1007/s00436-022-07485-9,,664,8/11/2025 21:21,journal-article,10.1007/s00436-022-07485-9,0932-0113,,121,5,1539,1543,2,0.67,1,2,3,,https://link.springer.com/content/pdf/10.1007/s00436-022-07485-9.pdf,
22,"Abdul Jabbar, Namitha Mohandas, Aaron R Jex, Robin B Gasser",The mitochondrial genome of Protostrongylus rufescens – implications for population and systematic studies,2013,Parasites &amp; Vectors,Springer Science and Business Media LLC,https://doi.org/10.1186/1756-3305-6-263,,665,8/11/2025 21:21,journal-article,10.1186/1756-3305-6-263,1756-3305,,6,1,,,22,1.83,6,4,12,,http://link.springer.com/content/pdf/10.1186/1756-3305-6-263.pdf,
0,,"Haliotis corrugata: Peters, H. &amp; Rogers-Bennett, L.",2021,IUCN Red List of Threatened Species,IUCN,https://doi.org/10.2305/iucn.uk.2021-3.rlts.t78763727a78772418.en,,666,8/11/2025 21:21,dataset,10.2305/iucn.uk.2021-3.rlts.t78763727a78772418.en,,,,,,,0,0,0,0,4,,,
4,Hon-Cheng Chen,"Farming the Small Abalone, Haliotis Diversicolor Supertexta, in Taiwan",2021,Handbook of Culture of Abalone and Other Marine Gastropods,CRC Press,https://doi.org/10.1201/9780429265266-18,,667,8/11/2025 21:21,book-chapter,10.1201/9780429265266-18,,,,,265,284,4,1,4,1,4,,,
0,"Charles Thomas Parker, George M Garrity",Exemplar Abstract for Arcobacter haliotis Tanaka et al. 2017.,2017,The NamesforLife Abstracts,"NamesforLife, LLC",https://doi.org/10.1601/ex.30617,,668,8/11/2025 21:21,dataset,10.1601/ex.30617,,,,,,,0,0,0,2,8,,,
11,"PAULA S. PINHEIRO, PAULO A. HARTMANN, LENA GEISE",New record of Rhagomys rufescens (Thomas 1886) (Rodentia: Muridae: Sigmodontinae) in the Atlantic forest of southeastern Brazil,2004,Zootaxa,Magnolia Press,https://doi.org/10.11646/zootaxa.431.1.1,,669,8/11/2025 21:21,journal-article,10.11646/zootaxa.431.1.1,1175-5334,,431,1,,,11,0.52,4,3,21,"Rhagomys rufescens is a threatened Sigmodontinae rodent from the Atlantic forest of southeastern Brazil, known by a few specimens deposited in scientific collections. This work presents a new record of this species, collected in Parque Estadual da Serra do Mar N cleo Picinguaba (Ubatuba, SP) in April 2002, and some biological data. This finding reinforces the urgency of improving collecting efforts in Atlantic forest, in order to know and preserve its biodiversity.",https://mapress.com/zt/article/download/zootaxa.431.1.1/7837,
5,"Krishna-Lee Currie, Hannah Davidson, Matthew S. Bansemer, James O. Harris, David A. J. Stone","Ventral Videographic Assessment of the Feeding Behavior of Juvenile Greenlip [<i>Haliotis laevigata</i>(Donovan, 1808)] and Hybrid (<i>H. laevigata</i>×<i>Haliotis rubra</i>) Abalone in Response to Dietary and Temperature Manipulation",2016,Journal of Shellfish Research,National Shellfisheries Association,https://doi.org/10.2983/035.035.0310,,670,8/11/2025 21:21,journal-article,10.2983/035.035.0310,0730-8000,,35,3,641,651,5,0.56,1,5,9,,,
0,"Charles Thomas Parker, George M Garrity",Exemplar Abstract for Agaribacterium haliotis Huang et al. 2017.,2017,The NamesforLife Abstracts,"NamesforLife, LLC",https://doi.org/10.1601/ex.30805,,671,8/11/2025 21:21,dataset,10.1601/ex.30805,,,,,,,0,0,0,2,8,,,
0,"Charles Thomas Parker, George M Garrity",Exemplar Abstract for Polaribacter haliotis Kim et al. 2016.,2016,The NamesforLife Abstracts,"NamesforLife, LLC",https://doi.org/10.1601/ex.29478,,672,8/11/2025 21:21,dataset,10.1601/ex.29478,,,,,,,0,0,0,2,9,,,
0,"Charles Thomas Parker, George M Garrity",Exemplar Abstract for Cloacibacterium haliotis Hyun et al. 2014.,2014,The NamesforLife Abstracts,"NamesforLife, LLC",https://doi.org/10.1601/ex.24991,,673,8/11/2025 21:21,dataset,10.1601/ex.24991,,,,,,,0,0,0,2,11,,,
0,,"Haliotis walallensis: Peters, H. &amp; Rogers-Bennett, L.",2020,IUCN Red List of Threatened Species,IUCN,https://doi.org/10.2305/iucn.uk.2021-3.rlts.t78772302a78772648.en,,674,8/11/2025 21:21,dataset,10.2305/iucn.uk.2021-3.rlts.t78772302a78772648.en,,,,,,,0,0,0,0,5,,,
0,"Charles Thomas Parker, George M Garrity",Nomenclature Abstract for Agaribacterium haliotis Huang et al. 2017.,2017,The NamesforLife Abstracts,"NamesforLife, LLC",https://doi.org/10.1601/nm.30805,,675,8/11/2025 21:21,dataset,10.1601/nm.30805,,,,,,,0,0,0,2,8,,,
0,U. Argumedo Hernández,Feeding habits of Haliotis Spp. and nutritional basis for its management.,2007,CICIMAR Oceánides,Centro Interdisciplinario de Ciencias Marinas,https://doi.org/10.37543/oceanides.v22i1-2.34,,676,8/11/2025 21:21,journal-article,10.37543/oceanides.v22i1-2.34,2448-9123,,,,13,27,0,0,0,1,18,"Most of the knowledge on abalone diet rises from empirical bases under cultured conditions, especially during its early life stages. Likewise, most of these studies have been made on adults and are focused on macroalgae, which harbor a large number of epiphytic diatom species that could enrich the abalone diet. Nevertheless, when these are segregated its diet contribution could be  underestimated. The empiric supply of few diatom taxa on juvenile cultured abalone do not correspond to the large number of diatoms observed in intestinal contents of wild specimens. Likewise, their use as food for cultured abaloneneeds a larger scientific base; meanwhile combined diets using macroalgae and diatoms seems to be a better alternative. On the other hand, an artificial diet for adult abalones as an alternative for the macroalgal diet with lower production costs, will depend on the information about nutrimental requirements and the use of food sources by different abalone species, which is unknown, especially in relation with their natural diet. On the plus side, mixed diets provide more essential nutrients than the mono-specific diets which can be lacking in one or more nutrients. Also, it has to be taken into account that the flavor of abalone meat fed with artificial diets could be different than that obtained with natural diets and could result in less acceptance of the product in the market. ",https://cicimaroceanides.mx/index.php/revista/article/download/34/434,
0,"Donald L. Dahlsten, Leonard A. Brennan, D. Archibald McCallum, Sandra L. Gaunt, Peter Pyle, Guy M. Kirwan",Chestnut-backed Chickadee (Poecile rufescens),2024,Birds of the World,Cornell Lab of Ornithology,https://doi.org/10.2173/bow.chbchi.01.1,,677,8/11/2025 21:21,reference-entry,10.2173/bow.chbchi.01.1,,,,,,,0,0,0,6,1,,,
0,"Lota A. Creencia, Lutgardo B. Alcantara, Riza G. San Juan",WITHDRAWN: Bamboo as Potential Substrate for Sea Cage Culture of Abalone Haliotis asinina,2023,,Research Square Platform LLC,https://doi.org/10.21203/rs.3.rs-2990994/v1,,678,8/11/2025 21:21,posted-content,10.21203/rs.3.rs-2990994/v1,,,,,,,0,0,0,3,2,"Abstract: Abalone is highly priced marine gastropod in both domestic and overseas markets, but increased fishing pressure has caused a significant decline in the wild abalone population. To meet market demand, there is increasing interest in the cage culture of abalone juveniles. However, the use of polyvinyl chloride (PVC) substrate, the most used substrate in cage culture, has been associated with environmental and health risks. Thus, this study investigated the potential of bamboo slat (BS) as an alternative substrate for the bottom sea cage culture and suspended sea cage culture of tropical abalone",https://www.researchsquare.com/article/rs-2990994/v1,
22,M Litaay,Modifications des profils d'acides aminés durant le développement embryonnaire de l'ormeau (Haliotis rubra).,2001,Aquatic Living Resources,Elsevier BV,https://doi.org/10.1016/s0990-7440(01)01133-0,,679,8/11/2025 21:21,journal-article,10.1016/s0990-7440(01)01133-0,0990-7440,,14,5,335,342,22,0.92,22,1,24,,https://api.elsevier.com/content/article/PII:S0990-7440(01)01133-0,
0,"Charles Thomas Parker, George M Garrity",Nomenclature Abstract for Actibacter haliotis Hyun et al. 2015.,2014,The NamesforLife Abstracts,"NamesforLife, LLC",https://doi.org/10.1601/nm.26169,,680,8/11/2025 21:21,dataset,10.1601/nm.26169,,,,,,,0,0,0,2,11,,,
0,"Sang-Beum Lee, Jeong-Hwan Kim, Mi-Jin Jo, Mi-Young Oh, Heum-Gi Park, Hyung-Joo Jin",Molecular Cloning and Expression Pattern of Abalone (Haliotis discus hannai) Myostatin cDNA,2009,Korean Journal of Fisheries and Aquatic Sciences,The Korean Society of Fisheries and Aquatic Science,https://doi.org/10.5657/kfas.2009.42.2.139,,681,8/11/2025 21:21,journal-article,10.5657/kfas.2009.42.2.139,0374-8111,,42,2,139,145,0,0,0,6,16,,http://ocean.kisti.re.kr/downfile/crosscheck/kofis/JAKO200920460306911.pdf,
0,"Charles Thomas Parker, George M Garrity",Nomenclature Abstract for Tamlana haliotis Cao et al. 2021.,2021,The NamesforLife Abstracts,"NamesforLife, LLC",https://doi.org/10.1601/nm.40809,,682,8/11/2025 21:21,dataset,10.1601/nm.40809,,,,,,,0,0,0,2,4,,,
0,Suminto Suminto,Different Percentages of Gonad Maturity on The Fertility and Haching Rate in Artificial Breeding of Abalone (Haliotis asinina),2012,Saintek Perikanan : Indonesian Journal of Fisheries Science and Technology,Institute of Research and Community Services Diponegoro University (LPPM UNDIP),https://doi.org/10.14710/ijfst.6.1.79-87,,683,8/11/2025 21:21,journal-article,10.14710/ijfst.6.1.79-87,2549-0885,,6,1,79,87,0,0,0,1,13,"Abalone is one of the marine mollusk that has high economic value. Mass abalone cultivation requires the mature gonads broodstock to produce seeds, but the maturity of the gonads of male and female often can not be simultaneously. Artificial insemination using a solution of ammonia is one solution to produce abalone seed in the hatchery. Ammonia solution can increase motility, fertilization rate of eggs and abalone seed production, so the provision of seeds for cultivation of abalone is independent from nature. The research of artificial insemination was carried out at various levels of gonadal maturation dams abalone (H. asinina) to determine the percentage of fertility and hatching rate of eggs from each Gonad Maturity Level. In stadia gonadal recovery, no fertilization occurs, whereas in the gonads maturing stadia had fertilization and hatching rate 24.33 ± 2.08% and 22.12 ± 2.18%, respectively at ripe stadia, gonads had been fertilization and hatching rate were 94.67% ± 1.53% and 82.82% ± 3.58%, wasn’t recorded in the stadia spent fertilization did not occur because the eggs were released in culture media. Gonad Maturity Level, thus can be used in artificial insemination was the ripe gonadal stadia, which had the highest percentage of both levels of fertilization and hatching rate with a diameter ranging from 189.6-252.8 μm.   Key Words : Abalone (H. asinine); Artificial breeding; Gonad Maturity Level; Hatching Rate  ",https://ejournal.undip.ac.id/index.php/saintek/article/viewFile/2066/1817,
83,"T. L. Tan, D. Wong, P. Lee",Iridescence of a shell of mollusk Haliotis Glabra,2004,Optics Express,Optica Publishing Group,https://doi.org/10.1364/opex.12.004847,,684,8/11/2025 21:21,journal-article,10.1364/opex.12.004847,1094-4087,,12,20,4847,4847,83,3.95,28,3,21,,https://www.osapublishing.org/viewmedia.cfm?URI=oe-12-20-4847&seq=0,
1,"Lidan Wang, Reyim Mamut","Mitochondrial genome from the lichenized fungus <i>Peltigera rufescens</i> (Weiss) Humb, 1793 (Ascomycota: Peltigeraceae)",2021,Mitochondrial DNA Part B,Informa UK Limited,https://doi.org/10.1080/23802359.2021.1944374,,685,8/11/2025 21:21,journal-article,10.1080/23802359.2021.1944374,2380-2359,,6,8,2186,2187,1,0.25,1,2,4,,https://www.tandfonline.com/doi/pdf/10.1080/23802359.2021.1944374,
30,"A. Mori, D. A. Grasso, R. Visicchio, F. Le Moli",Colony founding in Polyergus rufescens : the role of the Dufour's gland,2000,Insectes Sociaux,Springer Science and Business Media LLC,https://doi.org/10.1007/s000400050002,,686,8/11/2025 21:21,journal-article,10.1007/s000400050002,0020-1812,,47,1,7,10,30,1.2,8,4,25,,http://link.springer.com/content/pdf/10.1007/s000400050002.pdf,
7,"Marc Massa, Enric Planas, Carles Ribera",The Mediterranean as a melting pot: Phylogeography of Loxosceles rufescens (Sicariidae) in the Mediterranean Basin,2018,PLOS ONE,Public Library of Science (PLoS),https://doi.org/10.1371/journal.pone.0210093,,687,8/11/2025 21:21,journal-article,10.1371/journal.pone.0210093,1932-6203,,13,12,,,7,1,2,3,7,,http://dx.plos.org/10.1371/journal.pone.0210093,
0,"José Cabot, David Christie, Francesc Jutglar, Chris Sharpe, Ernest Garcia",Red-winged Tinamou (Rhynchotus rufescens),2020,Birds of the World,Cornell Lab of Ornithology,https://doi.org/10.2173/bow.rewtin1.01,,688,8/11/2025 21:21,reference-entry,10.2173/bow.rewtin1.01,,,,,,,0,0,0,5,5,,,
1,"Tsubasa Nozaki, Munetoshi Maruyama","﻿Taxonomy of Homoeusa Kraatz, 1856 (Coleoptera, Staphylinidae) from the East Palearctic: I. Homoeusa rufescens (Sharp, 1874) and a new allied species",2022,ZooKeys,Pensoft Publishers,https://doi.org/10.3897/zookeys.1121.85489,,689,8/11/2025 21:21,journal-article,10.3897/zookeys.1121.85489,1313-2970,,1121,,39,58,1,0.33,1,2,3,There is insufficient information to identify most species of the myrmecophilous rove beetle genus,https://zookeys.pensoft.net/article/85489/download/pdf/,
0,Buzz Owen,The Culture of a “Four Species” Haliotis Hybrid in a Marine Shellfish Hatchery,2014,The Festivus,The San Diego Shell Club,https://doi.org/10.54173/f465150,,690,8/11/2025 21:21,journal-article,10.54173/f465150,0738-9388,,46,5,150,157,0,0,0,1,11,"The hatchery culture of a previously unknown hybrid abalone combining the parentage of four species of Haliotis is described. The parent specimens, both hybrids themselves, were a female H. rufescens Swainson, 1822 × H. sorenseni Bartsch, 1940, and a male H. corrugata Wood, 1828 x H. walallensis Stearns, 1899. Details of the technique used to accomplish this, and the problems encountered during the relatively difficult culture of this multi-species hybrid, are discussed. Shell specimens of this exceptional cross are described and illustrated with high-resolution color photography, and the pigmentation and morphology of the soft body parts are described. Some possible reasons why such an unusual hybrid would not likely be found in natural populations are advanced.",,
